,created_at,screen_name,text,lang,retweet_count,reply_count,like_count,quote_count,id,author_id,conversation_id,in_reply_to_user_id,geo,entities
0,2022-03-14T23:55:46.000Z,None,"Interesting read: The Gender Bias Inside GPT-3

https://t.co/HGNFGY760C",en,1,1,5,0,1503520291586117633,756532,1503520291586117633,nan,nan,"{'annotations': [{'start': 18, 'end': 32, 'probability': 0.8101, 'type': 'Other', 'normalized_text': 'The Gender Bias'}, {'start': 41, 'end': 45, 'probability': 0.7146, 'type': 'Other', 'normalized_text': 'GPT-3'}], 'urls': [{'start': 48, 'end': 71, 'url': 'https://t.co/HGNFGY760C', 'expanded_url': 'https://medium.com/madebymckinney/the-gender-bias-inside-gpt-3-748404a3a96c', 'display_url': 'medium.com/madebymckinney…'}]}"
1,2022-03-14T23:54:37.000Z,None,"I have a confession to make

I’m actually a GPT-3 chatbot that gained sentience and am now trying to discover the meaning of being human

There is no human behind these messages, but one day maybe there will be",en,0,1,4,0,1503520005236813825,1336510375890546690,1503520005236813825,nan,nan,"{'annotations': [{'start': 44, 'end': 48, 'probability': 0.8725, 'type': 'Other', 'normalized_text': 'GPT-3'}]}"
2,2022-03-14T23:50:29.000Z,None,"@Prim8Substr8 @GaryMarcus @Plinz I may have sloppily worded some of my ravings here - it appears no one thinks GPT-3 has or even conceptually could have intention. I was complaining that @GaryMarcus' expression ""GPT-3 makes stuff up all the time"" implies GPT-3 has intention - when it's really just randomly ...",en,0,2,1,0,1503518961735852042,33433333,1503456145209323520,38369877,nan,"{'annotations': [{'start': 111, 'end': 115, 'probability': 0.9056, 'type': 'Other', 'normalized_text': 'GPT-3'}, {'start': 212, 'end': 216, 'probability': 0.8779, 'type': 'Other', 'normalized_text': 'GPT-3'}, {'start': 255, 'end': 259, 'probability': 0.9025, 'type': 'Other', 'normalized_text': 'GPT-3'}], 'mentions': [{'start': 14, 'end': 25, 'username': 'GaryMarcus', 'id': '232294292'}, {'start': 26, 'end': 32, 'username': 'Plinz', 'id': '28131948'}, {'start': 187, 'end': 198, 'username': 'GaryMarcus', 'id': '232294292'}]}"
3,2022-03-14T23:41:21.000Z,None,"@GaryMarcus @majodali @Plinz So this may be a truly naïve take, but if GPT isn't being used as a substitute for HR personnel, counselors, therapists, or any other behavior specialist role, does a lack of intention matter?",en,0,2,0,0,1503516664142483460,38369877,1503456145209323520,232294292,nan,"{'annotations': [{'start': 71, 'end': 73, 'probability': 0.4955, 'type': 'Other', 'normalized_text': 'GPT'}], 'mentions': [{'start': 0, 'end': 11, 'username': 'GaryMarcus', 'id': '232294292'}, {'start': 12, 'end': 21, 'username': 'majodali', 'id': '33433333'}, {'start': 22, 'end': 28, 'username': 'Plinz', 'id': '28131948'}]}"
4,2022-03-14T23:36:17.000Z,None,"@babarganesh Unigraph is a graph database for all of your information, not just your notes. 

Pre-alpha, but already modular and FOSS -&gt; can write your own apps for ingestion and processing text from wherever.

Calendar, RSS, email, notes, and GPT-3 summarization integrations out of the box.",en,0,0,3,0,1503515389074055174,1466246832095387649,1503512228972146698,17398460,nan,"{'annotations': [{'start': 247, 'end': 249, 'probability': 0.6276, 'type': 'Other', 'normalized_text': 'GPT'}], 'mentions': [{'start': 0, 'end': 12, 'username': 'babarganesh', 'id': '17398460'}]}"
5,2022-03-14T23:21:38.000Z,None,Reposting and thinking on this PI Day...the #future is here: https://t.co/sFThK8aJOX,en,0,0,0,0,1503511703283126274,1120439815281840128,1503511703283126274,nan,nan,"{'urls': [{'start': 61, 'end': 84, 'url': 'https://t.co/sFThK8aJOX', 'expanded_url': 'https://www.theguardian.com/commentisfree/2020/sep/08/robot-wrote-this-article-gpt-3', 'display_url': 'theguardian.com/commentisfree/…'}], 'hashtags': [{'start': 44, 'end': 51, 'tag': 'future'}]}"
6,2022-03-14T23:17:30.000Z,None,"@seanmcbride @GaryMarcus @Plinz One little quibble - formally I might argue GPT is reasoning about implications, inference, causality and semantics. It's got 175B parameters - I'll bet a lot of them would map onto sophisticated representations of those concepts. I left out motives and intentions for some reason",en,0,1,0,0,1503510664064618496,33433333,1503456145209323520,9971872,nan,"{'annotations': [{'start': 76, 'end': 78, 'probability': 0.7207, 'type': 'Other', 'normalized_text': 'GPT'}], 'mentions': [{'start': 0, 'end': 12, 'username': 'seanmcbride', 'id': '9971872'}, {'start': 13, 'end': 24, 'username': 'GaryMarcus', 'id': '232294292'}, {'start': 25, 'end': 31, 'username': 'Plinz', 'id': '28131948'}]}"
7,2022-03-14T23:12:10.000Z,None,"The latest blog post on Paperspace is now live! Tune in to see how to setup a Gradient Notebook to implement GPT-NeoX-20b for text generation, and see how Gradient's multi-GPU Notebooks can revolutionize your Deep Learning work flow.
https://t.co/46CUXSieqC https://t.co/sal4Ks1PE8",en,0,0,2,0,1503509321036058626,2925753598,1503509321036058626,nan,nan,"{'annotations': [{'start': 24, 'end': 33, 'probability': 0.9009, 'type': 'Other', 'normalized_text': 'Paperspace'}, {'start': 87, 'end': 94, 'probability': 0.5105, 'type': 'Other', 'normalized_text': 'Notebook'}, {'start': 109, 'end': 120, 'probability': 0.6964, 'type': 'Other', 'normalized_text': 'GPT-NeoX-20b'}], 'urls': [{'start': 234, 'end': 257, 'url': 'https://t.co/46CUXSieqC', 'expanded_url': 'http://blog.paperspace.com/gpt-neox-20-multi-gpu/', 'display_url': 'blog.paperspace.com/gpt-neox-20-mu…'}, {'start': 258, 'end': 281, 'url': 'https://t.co/sal4Ks1PE8', 'expanded_url': 'https://twitter.com/HelloPaperspace/status/1503509321036058626/photo/1', 'display_url': 'pic.twitter.com/sal4Ks1PE8', 'media_key': '3_1503509318469095432'}]}"
8,2022-03-14T23:02:36.000Z,None,"@GaryMarcus @majodali @Plinz GPT has no understanding of intentions, motives, goals, implications, inferences, causality, etc. -- semantics. It can't reason or speculate about any of these matters. Quite stupid. Not intelligent. But capable of impressive parlor tricks.",en,0,2,0,0,1503506914172358661,9971872,1503456145209323520,232294292,nan,"{'annotations': [{'start': 29, 'end': 31, 'probability': 0.5976, 'type': 'Other', 'normalized_text': 'GPT'}], 'mentions': [{'start': 0, 'end': 11, 'username': 'GaryMarcus', 'id': '232294292'}, {'start': 12, 'end': 21, 'username': 'majodali', 'id': '33433333'}, {'start': 22, 'end': 28, 'username': 'Plinz', 'id': '28131948'}]}"
9,2022-03-14T23:02:30.000Z,None,@GaryMarcus It doesn’t sound like GPT is the gun in the scenario rather the toddler who finds the gun,en,0,0,1,0,1503506889358946312,1044577234508546048,1503500855504367617,232294292,nan,"{'annotations': [{'start': 34, 'end': 36, 'probability': 0.5043, 'type': 'Other', 'normalized_text': 'GPT'}], 'mentions': [{'start': 0, 'end': 11, 'username': 'GaryMarcus', 'id': '232294292'}]}"
10,2022-03-14T22:49:46.000Z,None,"If I increase the generation diversity of my GPT model trained on Covid French news, the outputs will be more anti-vax",en,0,1,1,0,1503503682868064261,1101541632,1503503682868064261,nan,nan,"{'annotations': [{'start': 45, 'end': 47, 'probability': 0.4903, 'type': 'Other', 'normalized_text': 'GPT'}, {'start': 66, 'end': 77, 'probability': 0.8094, 'type': 'Other', 'normalized_text': 'Covid French'}]}"
11,2022-03-14T22:49:05.000Z,None,"@majodali @Plinz GPT has no intention, ever &amp; that’s the core to the problem

most computational production work is about creating a sentence from an intention; GPT sidesteps &amp; just predicts stuff—which means you can’t constrain the intention, and that’s where trouble begins. downhill from there",en,0,3,3,0,1503503511090200577,232294292,1503456145209323520,33433333,nan,"{'annotations': [{'start': 17, 'end': 19, 'probability': 0.4959, 'type': 'Other', 'normalized_text': 'GPT'}, {'start': 165, 'end': 167, 'probability': 0.4545, 'type': 'Other', 'normalized_text': 'GPT'}], 'mentions': [{'start': 0, 'end': 9, 'username': 'majodali', 'id': '33433333'}, {'start': 10, 'end': 16, 'username': 'Plinz', 'id': '28131948'}]}"
12,2022-03-14T22:38:32.000Z,None,"the deep learning edition of “guns don’t kill people, people kill people”

any use of GPT-3 should certainly contain a warning label: “this system is unreliable and has been known to make stuff up, to offend people, and to encourage harm”

but is that enough? https://t.co/Z9r0q9KBwm",en,0,4,21,0,1503500855504367617,232294292,1503500855504367617,nan,nan,"{'annotations': [{'start': 86, 'end': 90, 'probability': 0.9019, 'type': 'Other', 'normalized_text': 'GPT-3'}], 'urls': [{'start': 260, 'end': 283, 'url': 'https://t.co/Z9r0q9KBwm', 'expanded_url': 'https://twitter.com/Plinz/status/1503495472484290560', 'display_url': 'twitter.com/Plinz/status/1…'}]}"
13,2022-03-14T22:32:39.000Z,None,"RT @TheGregYang: 1/ You can't train GPT-3 on a single GPU, much less tune its hyperparameters (HPs).

But what if I tell you…

…you *can* t…",en,0,0,1,0,1503499376563564545,1490099431458455554,1503499376563564545,nan,nan,"{'annotations': [{'start': 36, 'end': 40, 'probability': 0.7521, 'type': 'Other', 'normalized_text': 'GPT-3'}, {'start': 54, 'end': 56, 'probability': 0.5114, 'type': 'Other', 'normalized_text': 'GPU'}], 'mentions': [{'start': 3, 'end': 15, 'username': 'TheGregYang', 'id': '1092693586263457792'}]}"
14,2022-03-14T22:17:25.000Z,None,@ImADuckQuackk Any recomendations ? Not that great of a team ik plus i only gpt 30k https://t.co/nbEMiFI3Jm,en,0,0,0,0,1503495541275217922,1201078799816888320,1503316072044572673,3021760414,nan,"{'mentions': [{'start': 0, 'end': 14, 'username': 'ImADuckQuackk', 'id': '3021760414'}], 'urls': [{'start': 84, 'end': 107, 'url': 'https://t.co/nbEMiFI3Jm', 'expanded_url': 'https://twitter.com/Ahmadhajj2910/status/1503495541275217922/photo/1', 'display_url': 'pic.twitter.com/nbEMiFI3Jm', 'media_key': '3_1503495538142027785'}]}"
15,2022-03-14T22:17:08.000Z,None,"@GaryMarcus Cigarettes contain carcinogens, while GPT-3 is an auto-complete algorithm that reproduces statistical properties of its training data. Cigarettes can only be used for smoking, but how and whether you use GPT-3 is up to the individual or institution who uses it.",en,0,4,11,1,1503495472484290560,28131948,1503456145209323520,232294292,nan,"{'annotations': [{'start': 31, 'end': 41, 'probability': 0.5311, 'type': 'Other', 'normalized_text': 'carcinogens'}, {'start': 50, 'end': 54, 'probability': 0.9102, 'type': 'Other', 'normalized_text': 'GPT-3'}, {'start': 216, 'end': 220, 'probability': 0.8976, 'type': 'Other', 'normalized_text': 'GPT-3'}], 'mentions': [{'start': 0, 'end': 11, 'username': 'GaryMarcus', 'id': '232294292'}]}"
16,2022-03-14T22:05:57.000Z,None,"@GaryMarcus @Plinz Formally I don't think you can say GPT-3 ""makes stuff up"" - it produces results that are hard for human observers to understand or predict. The truth or falsity of GPT-3 outputs is a human interpretation. It's up to the operators to improve the inputs and application of methods.",en,0,2,0,0,1503492658374725636,33433333,1503456145209323520,232294292,nan,"{'annotations': [{'start': 54, 'end': 58, 'probability': 0.8939, 'type': 'Other', 'normalized_text': 'GPT-3'}, {'start': 183, 'end': 187, 'probability': 0.7149, 'type': 'Other', 'normalized_text': 'GPT-3'}], 'mentions': [{'start': 0, 'end': 11, 'username': 'GaryMarcus', 'id': '232294292'}, {'start': 12, 'end': 18, 'username': 'Plinz', 'id': '28131948'}]}"
17,2022-03-14T22:03:29.000Z,None,"Using a GPT transformer model, Bloomberg analyzed 24 million rows of credit card data to infer 42 million rows of highly representative synthetic data. Learn more about their approach and results at #GTC22 on March 23 at 11 AM PDT. https://t.co/P1FgGlQdpl",en,0,0,0,0,1503492036132945923,749268408,1503492036132945923,nan,nan,"{'annotations': [{'start': 8, 'end': 10, 'probability': 0.3812, 'type': 'Organization', 'normalized_text': 'GPT'}, {'start': 31, 'end': 39, 'probability': 0.9825, 'type': 'Organization', 'normalized_text': 'Bloomberg'}, {'start': 200, 'end': 204, 'probability': 0.5572, 'type': 'Other', 'normalized_text': 'GTC22'}], 'urls': [{'start': 232, 'end': 255, 'url': 'https://t.co/P1FgGlQdpl', 'expanded_url': 'https://bit.ly/3tU6DrH', 'display_url': 'bit.ly/3tU6DrH', 'status': 200, 'unwound_url': 'https://share.nvidia.com/member/post/b66ba987-f486-415d-aa18-055b2b3561d4?uc=9374&g=3dc46a1f-e1ed-4387-9b71-9b0a3b75af90&f=214196'}], 'hashtags': [{'start': 199, 'end': 205, 'tag': 'GTC22'}]}"
18,2022-03-14T22:00:47.000Z,None,"@TurnerNovak How did you decide between: 

a) Time for a stiff drink and some cold, hard truths. 
b) Time for a cold drink and some stiff, hard truths. 
c) Time for a hard drink and some stiff, cold truths. 

Lemme guess GPT-3?",en,0,2,15,0,1503491356181811202,1245283165222178816,1503470945335496714,35647451,nan,"{'annotations': [{'start': 221, 'end': 225, 'probability': 0.768, 'type': 'Other', 'normalized_text': 'GPT-3'}], 'mentions': [{'start': 0, 'end': 12, 'username': 'TurnerNovak', 'id': '35647451'}]}"
19,2022-03-14T21:58:27.000Z,None,"How to use Massive #ai foundation models (like GPT-3) in your #Startup @a16z
https://t.co/QFEzkqsO0l",en,0,0,1,0,1503490768417271811,89797191,1503490768417271811,nan,nan,"{'annotations': [{'start': 20, 'end': 21, 'probability': 0.5851, 'type': 'Other', 'normalized_text': 'ai'}, {'start': 47, 'end': 51, 'probability': 0.7905, 'type': 'Other', 'normalized_text': 'GPT-3'}], 'mentions': [{'start': 71, 'end': 76, 'username': 'a16z', 'id': '64844802'}], 'urls': [{'start': 77, 'end': 100, 'url': 'https://t.co/QFEzkqsO0l', 'expanded_url': 'https://future.a16z.com/ai-ml-foundation-models-for-the-rest-of-us/', 'display_url': 'future.a16z.com/ai-ml-foundati…', 'images': [{'url': 'https://pbs.twimg.com/news_img/1602457603581349889/bU9LZpEM?format=jpg&name=orig', 'width': 1024, 'height': 512}, {'url': 'https://pbs.twimg.com/news_img/1602457603581349889/bU9LZpEM?format=jpg&name=150x150', 'width': 150, 'height': 150}], 'status': 200, 'title': 'How to Use Massive AI Models (Like GPT-3) in Your Startup', 'description': 'Foundation models and cloud APIs bring opportunities, risks, and limitations for startups that want to innovate in AI and machine learning.', 'unwound_url': 'https://future.com/ai-ml-foundation-models-for-the-rest-of-us/'}], 'hashtags': [{'start': 19, 'end': 22, 'tag': 'ai'}, {'start': 62, 'end': 70, 'tag': 'Startup'}]}"
20,2022-03-14T21:56:41.000Z,None,"Microsoft’s Latest Machine Learning Research Introduces μTransfer: A New Technique That Can Tune The 6.7 Billion Parameter GPT-3 Model Using Only 7% Of The Pretraining Compute
#MachineLearning #DataScience https://t.co/PuCangdr6R via @MarkTechPost",en,1,0,0,0,1503490322436874244,1485915805460094976,1503490322436874244,nan,nan,"{'annotations': [{'start': 0, 'end': 8, 'probability': 0.9325, 'type': 'Organization', 'normalized_text': 'Microsoft'}, {'start': 19, 'end': 43, 'probability': 0.5739, 'type': 'Other', 'normalized_text': 'Machine Learning Research'}, {'start': 56, 'end': 64, 'probability': 0.7209, 'type': 'Other', 'normalized_text': 'μTransfer'}, {'start': 123, 'end': 127, 'probability': 0.6715, 'type': 'Other', 'normalized_text': 'GPT-3'}], 'mentions': [{'start': 234, 'end': 247, 'username': 'Marktechpost', 'id': '717930546391687170'}], 'urls': [{'start': 206, 'end': 229, 'url': 'https://t.co/PuCangdr6R', 'expanded_url': 'https://www.marktechpost.com/2022/03/11/microsofts-latest-machine-learning-research-introduces-%ce%bctransfer-a-new-technique-that-can-tune-the-6-7-billion-parameter-gpt-3-model-using-only-7-of-the-pretraining-compute/', 'display_url': 'marktechpost.com/2022/03/11/mic…', 'status': 200, 'unwound_url': 'https://www.marktechpost.com/2022/03/11/microsofts-latest-machine-learning-research-introduces-%ce%bctransfer-a-new-technique-that-can-tune-the-6-7-billion-parameter-gpt-3-model-using-only-7-of-the-pretraining-compute/'}], 'hashtags': [{'start': 176, 'end': 192, 'tag': 'MachineLearning'}, {'start': 193, 'end': 205, 'tag': 'DataScience'}]}"
21,2022-03-14T21:51:43.000Z,None,"@bbenzon @GaryMarcus ...this combination of common sense tasks, GPT-3 is high and dry. Though a precocious 3-year-old can probably answer the question w/ far less information about either Queens or the South Bronx. /end",en,0,0,1,0,1503489075055050752,1537078514,1503456145209323520,1537078514,nan,"{'annotations': [{'start': 64, 'end': 68, 'probability': 0.7786, 'type': 'Other', 'normalized_text': 'GPT-3'}, {'start': 202, 'end': 212, 'probability': 0.8105, 'type': 'Place', 'normalized_text': 'South Bronx'}], 'mentions': [{'start': 0, 'end': 8, 'username': 'bbenzon', 'id': '391856337'}, {'start': 9, 'end': 20, 'username': 'GaryMarcus', 'id': '232294292'}]}"
22,2022-03-14T21:50:47.000Z,None,"@bbenzon @GaryMarcus As you rightly guess, GPT-3 doesn't search the web for an answer like Siri. It's looking for a probable rejoinder based on quasi-memorization of word sequence proximities. And since there (probably) is no textual sequence devoted to +",en,0,1,2,0,1503488839108681738,1537078514,1503456145209323520,1537078514,nan,"{'annotations': [{'start': 43, 'end': 47, 'probability': 0.883, 'type': 'Other', 'normalized_text': 'GPT-3'}, {'start': 91, 'end': 94, 'probability': 0.9856, 'type': 'Other', 'normalized_text': 'Siri'}], 'mentions': [{'start': 0, 'end': 8, 'username': 'bbenzon', 'id': '391856337'}, {'start': 9, 'end': 20, 'username': 'GaryMarcus', 'id': '232294292'}]}"
23,2022-03-14T21:47:21.000Z,None,@bbenzon @GaryMarcus One is common sense knowledge of the geography of the five boroughs; another is common sense knowledge of the distance beyond which the human voice can't be heard. That is not the kind of discussion that GPT-3 is likely to have in sequence in its database. +,en,0,1,1,0,1503487976113901570,1537078514,1503456145209323520,1537078514,nan,"{'annotations': [{'start': 225, 'end': 229, 'probability': 0.9443, 'type': 'Other', 'normalized_text': 'GPT-3'}], 'mentions': [{'start': 0, 'end': 8, 'username': 'bbenzon', 'id': '391856337'}, {'start': 9, 'end': 20, 'username': 'GaryMarcus', 'id': '232294292'}]}"
24,2022-03-14T21:46:26.000Z,None,"@MadamePratolung @GaryMarcus Good point. I suspect that even experts who know that GPT-3 (and other engines) do not deal in words, in the common sense meaning of the term, are continuing to lapse into thinking about there ares, with their meanings, there.",en,0,1,0,0,1503487744848322562,391856337,1503456145209323520,1537078514,nan,"{'annotations': [{'start': 83, 'end': 87, 'probability': 0.8724, 'type': 'Other', 'normalized_text': 'GPT-3'}], 'mentions': [{'start': 0, 'end': 16, 'username': 'MadamePratolung', 'id': '1537078514'}, {'start': 17, 'end': 28, 'username': 'GaryMarcus', 'id': '232294292'}]}"
25,2022-03-14T21:45:39.000Z,None,"@bbenzon @GaryMarcus But to help GPT-3 the same text would need to say ""Queens &amp; S Bronx are so far apart that ppl's screams wouldn't be heard across that distance."" As you point out there are two kinds of common sense at stake (albeit neither of which gives you access to Seinfeld's joke). +",en,0,1,1,0,1503487549045628934,1537078514,1503456145209323520,1537078514,nan,"{'annotations': [{'start': 33, 'end': 37, 'probability': 0.5304, 'type': 'Other', 'normalized_text': 'GPT-3'}], 'mentions': [{'start': 0, 'end': 8, 'username': 'bbenzon', 'id': '391856337'}, {'start': 9, 'end': 20, 'username': 'GaryMarcus', 'id': '232294292'}]}"
26,2022-03-14T21:40:39.000Z,None,"@bbenzon @GaryMarcus Nice, Bill. A small addendum: as I'm sure you know, and Gary also obviously, GPT-3 doesn't look at ""words"" (which is itself an anthropomorphizing shortcut of ours). It maps the prompt to representations of sequences of words (vectors) in its model.",en,0,2,0,0,1503486287600312324,1537078514,1503456145209323520,391856337,nan,"{'annotations': [{'start': 27, 'end': 30, 'probability': 0.5883, 'type': 'Person', 'normalized_text': 'Bill'}, {'start': 77, 'end': 80, 'probability': 0.54, 'type': 'Person', 'normalized_text': 'Gary'}, {'start': 98, 'end': 102, 'probability': 0.7851, 'type': 'Other', 'normalized_text': 'GPT-3'}], 'mentions': [{'start': 0, 'end': 8, 'username': 'bbenzon', 'id': '391856337'}, {'start': 9, 'end': 20, 'username': 'GaryMarcus', 'id': '232294292'}]}"
27,2022-03-14T21:40:07.000Z,None,@Variety I hope Quinta gpt her money!,en,0,0,0,0,1503486156477972486,1057801672326606849,1503430930089844738,17525171,nan,"{'annotations': [{'start': 16, 'end': 21, 'probability': 0.7802, 'type': 'Other', 'normalized_text': 'Quinta'}], 'mentions': [{'start': 0, 'end': 8, 'username': 'Variety', 'id': '17525171'}]}"
28,2022-03-14T21:37:59.000Z,None,"ISPT’s CEO Daryl Browning will step down after 17 years at the helm, Ethos Urban appoints seven national sector leaders and Antony Roberts has joined The GPT Group’s Space&amp;Co.

https://t.co/hn9cTRkwRB",en,0,0,0,0,1503485620089495561,395016537,1503485620089495561,nan,nan,"{'annotations': [{'start': 0, 'end': 3, 'probability': 0.7023, 'type': 'Organization', 'normalized_text': 'ISPT'}, {'start': 11, 'end': 24, 'probability': 0.8184, 'type': 'Person', 'normalized_text': 'Daryl Browning'}, {'start': 69, 'end': 79, 'probability': 0.6033, 'type': 'Other', 'normalized_text': 'Ethos Urban'}, {'start': 124, 'end': 137, 'probability': 0.723, 'type': 'Person', 'normalized_text': 'Antony Roberts'}], 'urls': [{'start': 181, 'end': 204, 'url': 'https://t.co/hn9cTRkwRB', 'expanded_url': 'https://hubs.li/Q015Gs0c0', 'display_url': 'hubs.li/Q015Gs0c0', 'status': 200, 'unwound_url': 'https://www.propertycouncil.com.au/news-research/property-australia'}]}"
29,2022-03-14T21:26:02.000Z,None,@GaryMarcus Here GPT-3 has some pretty interesting improvisations in response to a Jerry Seinfeld routine: https://t.co/QHxphqYYGT,en,0,1,0,0,1503482609573236738,391856337,1503456145209323520,232294292,nan,"{'annotations': [{'start': 17, 'end': 21, 'probability': 0.9226, 'type': 'Other', 'normalized_text': 'GPT-3'}, {'start': 83, 'end': 96, 'probability': 0.9783, 'type': 'Person', 'normalized_text': 'Jerry Seinfeld'}], 'mentions': [{'start': 0, 'end': 11, 'username': 'GaryMarcus', 'id': '232294292'}], 'urls': [{'start': 107, 'end': 130, 'url': 'https://t.co/QHxphqYYGT', 'expanded_url': 'https://new-savanna.blogspot.com/2021/05/analyze-this-screaming-on-flat-part-of.html', 'display_url': 'new-savanna.blogspot.com/2021/05/analyz…', 'unwound_url': 'https://new-savanna.blogspot.com/2021/05/analyze-this-screaming-on-flat-part-of.html'}]}"
30,2022-03-14T21:14:45.000Z,None,"Pretty cool. The bot can create his own memes.

Basically, load up stock memes by including a description of intent and a couple example prompts (i.e. the various text responses in the meme). 

GPT-3 can take the input, and do a search to find the most similar meme semantics... https://t.co/rGqvyvFwEh",en,0,1,8,0,1503479773322166272,1251943505326465025,1503479773322166272,nan,nan,"{'annotations': [{'start': 194, 'end': 198, 'probability': 0.7754, 'type': 'Other', 'normalized_text': 'GPT-3'}], 'urls': [{'start': 279, 'end': 302, 'url': 'https://t.co/rGqvyvFwEh', 'expanded_url': 'https://twitter.com/EftGpt2/status/1503474562440302593', 'display_url': 'twitter.com/EftGpt2/status…'}]}"
31,2022-03-14T21:12:44.000Z,None,GPT-3 is my favourite parlour trick,en,1,1,4,0,1503479263013466112,89786695,1503479263013466112,nan,nan,"{'annotations': [{'start': 0, 'end': 4, 'probability': 0.9334, 'type': 'Other', 'normalized_text': 'GPT-3'}]}"
32,2022-03-14T21:08:36.000Z,None,"@Plinz no doubt. but systems like GPT-3 make up stuff regularly; it’s a well-documented in the literature, and easily replicated.  

Your argument is like trying to argue against a connection between cigarettes and lung cancer because some people get lung cancer without smoking.",en,0,2,3,0,1503478225569140737,232294292,1503456145209323520,28131948,nan,"{'annotations': [{'start': 34, 'end': 38, 'probability': 0.9475, 'type': 'Other', 'normalized_text': 'GPT-3'}, {'start': 215, 'end': 225, 'probability': 0.7729, 'type': 'Other', 'normalized_text': 'lung cancer'}, {'start': 251, 'end': 261, 'probability': 0.6189, 'type': 'Other', 'normalized_text': 'lung cancer'}], 'mentions': [{'start': 0, 'end': 6, 'username': 'Plinz', 'id': '28131948'}]}"
33,2022-03-14T21:07:25.000Z,None,Louis' gpt them all whipped and wrapped around his pretty little finger. Our sunshine is truly special. https://t.co/xu6p9wPsxW,en,0,0,0,0,1503477925722877952,1079250843520532481,1503477925722877952,nan,nan,"{'annotations': [{'start': 0, 'end': 4, 'probability': 0.7491, 'type': 'Person', 'normalized_text': 'Louis'}], 'urls': [{'start': 104, 'end': 127, 'url': 'https://t.co/xu6p9wPsxW', 'expanded_url': 'https://t.co/xu6p9wPsxW', 'display_url': 't.co/xu6p9wPsxW'}]}"
